<?xml version="1.0" encoding="UTF-8"?>
<!DOCTYPE appia PUBLIC "-//DTDName//DTD//EN"
	"../xml/appiaxml.dtd">
<appia>
	<template name="ecco_t">
		<session name="tcp_s" sharing="private">
			<protocol>net.sf.appia.protocols.tcpcomplete.TcpCompleteLayer</protocol>
		</session>
		<session name="reconfig_s" sharing="global">
			<protocol>net.sf.appia.protocols.reconfigurator.ReconfiguratorLayer</protocol>
		</session>
		<session name="ecco_s" sharing="private">
			<protocol>net.sf.appia.test.xml.ecco.EccoLayer</protocol>
		</session>
	</template>
	<template name="reconfig_t">
		<session name="tcp_s" sharing="private">
			<protocol>net.sf.appia.protocols.tcpcomplete.TcpCompleteLayer</protocol>
		</session>
		<session name="reconfig_s" sharing="global">
			<protocol>net.sf.appia.protocols.reconfigurator.ReconfiguratorLayer</protocol>
		</session>
	</template>
	

	<channel name="ecco_c" template="ecco_t" initialized="yes">
		<chsession name="ecco_s">
			<parameter name="localport">4001</parameter>
			<parameter name="remotehost">localhost</parameter>
			<parameter name="remoteport">4000</parameter>
		</chsession>
	</channel>
	<channel name="manager_c" template="reconfig_t" initialized="yes">
		<chsession name="reconfig_s">
			<parameter name="localport">4002</parameter>
			<parameter name="remotehost">localhost</parameter>
			<parameter name="remoteport">4003</parameter>
		</chsession>
	</channel>	
	
</appia>
